,headlines
0,100 delegates from 54 nations to attend consecration ceremony
1,China is entering an era of stagnation -- like Japan of 1980s
2,ED team at Jharkhand CM Soren's residence to question him
3,Multiple boards format to debut with 2024-25 batch of Class X & XII
4,PM Modi offer prayers at Ranganathaswamy Temple in Tiruchirappalli
5,Ayodhya: Vikas and religion find confluence in kingdom of Ram
6,"What is D2M tech, what features works without internet"
7,"U-19 WC Live: Bangladesh win toss, opt to bowl vs India"
8,Get set for Samsung's game-changing Galaxy AI!
9,Shopping: Grand Appliances Sale (20-26 Jan) - Up to 55% OFF on Top Brands
10,UWA Online MBA with IIM Kozhikode Certificate
11,"AAP opposes 'One Nation, One Election' concept"
12,Minor delivers baby in toilet of Madhya Pradesh hospital
13,How angeethis and heaters put many in the line of fire
14,3-layered security cordon to guard Ram Lalla’s temple in Ayodhya
15,India smartphone market grows in Q4 2023
16,Indian CEO of US tech company dies in stage mishap
17,Indian org hit by 15% more weekly hackings in 2023: Report
18,1.8 lakh visas issued to Indian citizens by China in 2023
19,Alec Baldwin charged again with manslaughter in movie-set shooting
20,"'Thank you, Parveen, for touching my life': Mahesh Bhatt on Babi"
21,Jawa 350 first ride review: Classic ‘Legend’
